,Column Name,Data Type,Required?,Description
,Start,Date (YYYY-MM-DD),TRUE,The date the medication was prescribed.
,Stop,Date (YYYY-MM-DD),FALSE,"The date the prescription ended, if applicable."
,Patient,UUID,TRUE,Foreign key to the Patient.
,Encounter,UUID,TRUE,Foreign key to the Encounter where the medication was prescribed.
,Code,String,TRUE,Medication code from RxNorm.
,Description,String,TRUE,Description of the medication.
,Cost,Numeric,TRUE,The line item cost of the medication.
,ReasonCode,String,FALSE,Diagnosis code from SNOMED-CT specifying why this medication was prescribed.
,ReasonDescription,String,FALSE,Description of the reason code